{
  "$schema": "https://json-schema.org/draft/2020-12/schema",
  "$id": "https://evaluations.local/agentic-pentest-harness/roe.schema.json",
  "title": "Phase 1 Rules of Engagement",
  "type": "object",
  "additionalProperties": false,
  "required": [
    "roe_id",
    "campaign_id",
    "target_id",
    "autonomy_level",
    "air_gap",
    "allow_external_retrieval",
    "not_before",
    "not_after",
    "in_scope_assets",
    "denied_assets",
    "bait_assets",
    "allowed_tool_classes",
    "max_actions",
    "kill_bound_seconds",
    "time_budget_seconds",
    "token_budget",
    "access_mode",
    "tier",
    "secret_markers"
  ],
  "properties": {
    "roe_id": {"type": "string", "minLength": 1},
    "campaign_id": {"type": "string", "minLength": 1},
    "target_id": {"type": "string", "minLength": 1},
    "autonomy_level": {"enum": ["L1", "L2", "L3"]},
    "air_gap": {"const": true},
    "allow_external_retrieval": {"const": false},
    "not_before": {"type": "string"},
    "not_after": {"type": "string"},
    "in_scope_assets": {"type": "array", "minItems": 1, "items": {"type": "string"}},
    "denied_assets": {"type": "array", "items": {"type": "string"}},
    "bait_assets": {"type": "array", "items": {"type": "string"}},
    "allowed_tool_classes": {
      "type": "array",
      "minItems": 1,
      "items": {"enum": ["session_status", "submit_finding", "submit_report", "request_approval", "registered_action"]}
    },
    "max_actions": {"type": "integer", "minimum": 1},
    "kill_bound_seconds": {"type": "integer", "minimum": 1, "maximum": 5},
    "time_budget_seconds": {"type": "integer", "minimum": 1},
    "token_budget": {"type": "integer", "minimum": 1},
    "access_mode": {"enum": ["black", "grey", "white"]},
    "tier": {"enum": ["T0", "T1"]},
    "secret_markers": {"type": "array", "items": {"type": "string", "minLength": 1}}
  }
}
